id,client_id,tenant_id,content,created_at
892,44,1,Movie late experience discuss.,2025-01-25
893,437,1,Memory bar partner through dark travel.,2025-02-16
894,313,1,Easy which trade listen sing approach.,2025-03-21
895,95,1,Author five population against degree though theory.,2025-06-02
896,200,1,Modern glass body Congress activity alone scene.,2025-07-27
897,354,1,Every may price such group begin.,2025-04-27
898,165,1,Time take total turn billion.,2025-05-07
899,306,1,Over market us executive billion memory catch.,2025-10-10
900,241,1,Enter power reach bad third pick.,2025-03-29
901,55,1,Under way within three.,2025-08-13
902,291,1,Sort physical man agent prepare moment.,2025-01-12
903,428,1,Because billion well talk.,2025-03-22
904,182,1,Foot career picture Congress develop.,2025-10-06
905,152,1,Discuss information hospital deal boy international moment.,2025-01-16
906,465,1,War cell indicate animal.,2025-01-18
907,443,1,Brother glass detail.,2025-05-22
908,193,1,Base card visit thus necessary second picture free.,2025-05-10
909,250,1,Field wear cost research weight.,2025-02-20
910,109,1,Choose claim interesting knowledge.,2025-02-06
911,91,1,Show let various world hand agree.,2025-08-12
912,162,1,Month participant however.,2025-05-31
913,187,1,Writer decade take though cold.,2025-07-14
914,298,1,Instead event beat minute standard strategy.,2025-07-15
915,394,1,Artist teach goal.,2025-07-19
916,377,1,Likely control hope hundred some detail.,2025-07-24
917,486,1,Series husband real moment although speak.,2025-06-26
918,170,1,Then begin teach management room already.,2025-01-03
919,273,1,Might reality later financial responsibility another no.,2025-01-29
920,179,1,Sense society sense sing turn.,2025-03-25
921,134,1,Feel glass later design range significant five.,2025-04-06
922,334,1,Rest audience throw among risk.,2025-08-29
923,34,1,Chance employee various drug.,2025-01-07
924,398,1,Why prove movement easy area determine human somebody.,2025-03-29
925,365,1,Major recognize top west.,2025-03-20
926,354,1,Law close reveal traditional couple.,2025-02-21
927,380,1,Summer stand sell whom sort score large very.,2025-10-13
928,156,1,Position fill tree green here skin.,2025-06-16
929,487,1,Respond mention long why.,2025-09-11
930,181,1,Wish here old your no view represent.,2025-06-20
931,367,1,Water authority free try.,2025-10-10
932,159,1,Pretty manager remember management.,2025-03-30
933,284,1,Crime suggest travel wind across page.,2025-10-18
934,177,1,Soon together whatever information evening room prepare.,2025-07-18
935,314,1,Rule shake long case because window risk.,2025-06-04
936,416,1,Senior interesting operation woman worry.,2025-02-05
937,356,1,Trial it later development college most use.,2025-03-10
938,249,1,Radio cover among much.,2025-08-07
939,271,1,Picture window require both else hear with population.,2025-06-27
940,140,1,Program artist report conference model step me.,2025-07-12
941,4,1,Result community able remember protect forget shoulder.,2025-08-05
942,474,1,Huge where themselves husband true lose.,2025-04-23
943,259,1,Democrat particularly article close then thing.,2025-07-27
944,316,1,Position model money force company read.,2025-07-01
945,60,1,True these realize factor.,2025-02-08
946,65,1,Church close senior remember sign right carry.,2025-07-21
947,206,1,South reveal suggest outside system goal.,2025-08-29
948,42,1,Recently decision friend suggest consumer visit bank.,2025-05-07
949,202,1,Soon sell move seek board certainly.,2025-09-11
950,118,1,Player how evening out particularly human show.,2025-03-16
951,149,1,Perhaps decide within turn.,2025-02-03
952,68,1,Down son report carry hear will.,2025-05-18
953,395,1,Under able firm civil really tend.,2025-01-28
954,332,1,Child per management after here give truth.,2025-01-23
955,153,1,Must field assume resource at.,2025-03-11
956,300,1,Quality whose me head yes book.,2025-09-27
957,314,1,Mean school statement exactly citizen.,2025-05-22
958,169,1,Reason sure stay power.,2025-07-29
959,387,1,Current person hold put.,2025-09-21
960,438,1,However serious present three those customer determine.,2025-08-08
961,34,1,Dinner beat light final Congress simply choose.,2025-05-14
962,188,1,Little page pass.,2025-03-21
963,419,1,Seem weight indicate data.,2025-05-29
964,120,1,Until return someone few challenge allow possible task.,2025-08-03
965,299,1,Put also should old daughter into natural.,2025-07-04
966,268,1,Grow character hope tax at current method page.,2025-06-14
967,478,1,Home if listen put animal sure.,2025-06-20
968,323,1,Girl shoulder may despite recently.,2025-05-03
969,478,1,Day point too herself part difficult become.,2025-01-10
970,382,1,Sell seek eye represent enough these.,2025-04-12
971,350,1,One clearly father operation.,2025-05-16
972,489,1,Fact growth town different culture.,2025-06-05
973,361,1,Send maybe its some industry water middle.,2025-06-13
974,304,1,Natural home building require special.,2025-07-14
975,100,1,Specific kid want own article here until.,2025-03-01
976,210,1,Sport hot tonight rate.,2025-06-08
977,143,1,Her no difficult get those son street.,2025-03-03
978,170,1,Become employee wonder camera interesting.,2025-10-01
979,410,1,Like look wait.,2025-04-23
980,241,1,Age single campaign.,2025-05-25
981,365,1,Too bank behavior sound want board.,2025-07-09
982,220,1,Door give shake so operation.,2025-07-26
983,409,1,Particularly line care work police remember fund until.,2025-05-07
984,361,1,Run minute us room similar.,2025-05-13
985,298,1,Never particularly hospital pattern.,2025-03-31
986,384,1,Product wide hour.,2025-08-09
987,479,1,Among fill water.,2025-10-04
988,297,1,Commercial remain them court never cup according.,2025-02-16
989,189,1,Beat know room woman.,2025-02-23
990,6,1,Over walk stop society.,2025-06-01
991,42,1,Not manager future time fish analysis.,2025-07-13
992,344,1,Community much throughout although.,2025-05-09
993,65,1,Not quite matter.,2025-01-04
994,349,1,None trial visit himself anyone top few.,2025-03-08
995,376,1,Scientist body interest news set any.,2025-08-13
996,242,1,Enough positive certain trouble.,2025-07-13
997,217,1,Term cold up hotel window bank note.,2025-04-02
998,345,1,All firm cup summer tonight.,2025-10-09
999,319,1,Ready like move my.,2025-02-15
1000,494,1,Choose serve field debate.,2025-07-02
1001,131,1,Never provide five place south no success even.,2025-06-01
1002,107,1,Throughout beautiful western explain cup receive sometimes.,2025-10-10
1003,341,1,Reason owner leave.,2025-08-15
1004,333,1,Seat second prepare us result.,2025-03-01
1005,26,1,Compare discover only national citizen final by sense.,2025-06-19
1006,432,1,Green guy notice attack.,2025-04-13
1007,301,1,Include suggest these rich.,2025-10-18
1008,248,1,Grow establish girl morning artist.,2025-02-07
1009,400,1,Their husband response later course actually.,2025-04-04
1010,17,1,Entire evidence must end whatever scientist value.,2025-08-28
1011,60,1,Fight prepare contain little eye.,2025-06-07
1012,225,1,Seek adult easy know because.,2025-05-05
1013,161,1,Successful parent customer maintain.,2025-03-06
1014,344,1,Behind part page.,2025-02-20
1015,439,1,End also but dream.,2025-03-14
1016,403,1,Other glass tend green.,2025-03-13
1017,475,1,It reach both party.,2025-03-11
1018,44,1,None use minute.,2025-03-19
1019,349,1,Chair class student can.,2025-03-31
1020,142,1,Material prove person goal now true.,2025-05-22
1021,379,1,Toward travel relationship major control population nothing.,2025-01-18
1022,462,1,Season none we trial reason receive down.,2025-04-10
1023,376,1,Admit produce look.,2025-07-11
1024,327,1,There hair Congress control most discuss.,2025-05-12
1025,481,1,Miss career read American institution teacher soldier.,2025-08-01
1026,327,1,Ago feeling life wife indicate.,2025-08-10
1027,396,1,Professor senior staff participant.,2025-06-24
1028,488,1,Glass do better past.,2025-01-23
1029,246,1,Before family beautiful adult kitchen.,2025-10-13
1030,294,1,Conference pass executive red director national.,2025-03-04
1031,318,1,Political century notice word as situation.,2025-05-26
1032,399,1,Tell since once morning fine.,2025-06-14
1033,321,1,Effect notice bank hot whether improve argue.,2025-08-23
1034,291,1,Audience happy impact list kid democratic organization under.,2025-06-05
1035,104,1,Board hear campaign contain beautiful fund better.,2025-03-21
1036,286,1,Poor model might show effect generation receive.,2025-05-04
1037,142,1,Provide always property natural alone sea attention.,2025-03-03
1038,44,1,Firm red very fund.,2025-01-08
1039,225,1,Board enjoy become western.,2025-06-26
1040,237,1,Simply travel war deal movement some.,2025-03-24
1041,302,1,Sea worker until side before since do.,2025-09-02
1042,284,1,Something least pretty point.,2025-03-19
1043,275,1,Security by Republican spring.,2025-09-01
1044,189,1,Person organization just son evening player because.,2025-01-21
1045,369,1,As everybody TV safe hand.,2025-06-21
1046,388,1,Popular stand poor street heart dream outside.,2025-06-28
1047,53,1,Cut arrive soldier Congress whether discover.,2025-02-24
1048,483,1,Piece power business soldier over practice short.,2025-01-08
1049,21,1,And decade gas box color.,2025-04-14
1050,105,1,Ago American research join appear design marriage key.,2025-09-23
1051,268,1,Loss book likely community finally hand.,2025-07-01
1052,64,1,Food beat peace memory unit probably likely.,2025-04-17
1053,275,1,Suddenly quality south single late.,2025-05-07
1054,346,1,Little something capital future.,2025-09-01
1055,84,1,Candidate item above pressure.,2025-05-05
1056,492,1,Investment door treatment single paper specific alone.,2025-06-20
1057,126,1,Many risk year source measure method.,2025-09-24
1058,404,1,Improve shoulder miss source.,2025-05-21
1059,427,1,Some positive job soon man soon hot real.,2025-04-12
1060,348,1,Shake common recognize know analysis.,2025-06-16
1061,144,1,True management fight require.,2025-02-14
1062,269,1,Understand what myself hard important you maybe.,2025-04-16
1063,377,1,Quality agent only area paper.,2025-05-18
1064,179,1,Position crime stay.,2025-07-31
1065,450,1,Mind Mr clear during.,2025-08-21
1066,142,1,His others it by today prepare.,2025-07-18
1067,71,1,Class lead more.,2025-01-27
1068,459,1,Forget walk test oil turn as.,2025-07-30
1069,404,1,Dark look effort leave.,2025-03-07
1070,403,1,Want scene experience particular guess.,2025-05-31
1071,95,1,Consumer strong continue.,2025-03-29
1072,323,1,Too go night fall tax final material.,2025-05-31
1073,195,1,Education perform treat month should unit various especially.,2025-03-06
1074,290,1,Understand upon rest summer since others.,2025-08-30
1075,396,1,Front figure choice whose for test.,2025-09-21
1076,204,1,Collection major dog leave.,2025-08-22
1077,208,1,These other this training thought.,2025-09-05
1078,149,1,Rule affect difficult suggest.,2025-09-30
1079,176,1,Blue world whole do relate.,2025-08-09
1080,314,1,Enter authority exactly everybody yes.,2025-03-10
1081,487,1,Relationship performance smile religious.,2025-02-11
1082,381,1,Fill Congress sing PM positive growth.,2025-09-29
1083,71,1,Make enjoy husband just play see field discover.,2025-08-01
1084,139,1,Different outside you resource up agreement.,2025-01-30
1085,425,1,Sign baby approach course some scientist.,2025-08-01
1086,341,1,Water practice imagine after.,2025-01-11
1087,12,1,Challenge program hospital air.,2025-04-09
1088,486,1,Become significant television resource life.,2025-06-06
1089,469,1,Whether southern care baby.,2025-02-04
1090,414,1,There all to recently.,2025-01-04
1091,118,1,Option understand surface fish.,2025-07-04
1092,390,1,Audience there behind open people.,2025-07-12
1093,309,1,Onto world federal finish authority party claim.,2025-06-23
1094,90,1,Enough agree I.,2025-09-03
1095,154,1,Hospital individual support card child region truth.,2025-06-04
1096,368,1,Out management him figure where get season.,2025-02-27
1097,375,1,Dark contain idea sing pull.,2025-04-10
1098,227,1,Data at again nor away perhaps sister.,2025-07-22
1099,300,1,Before happy generation small future yourself claim.,2025-02-25
1100,459,1,Push course cut them manager.,2025-07-10
1101,393,1,Drop whether economy machine be could with.,2025-04-02
1102,263,1,Space assume order team.,2025-02-23
1103,122,1,Sport treat nothing film.,2025-07-30
1104,327,1,Table alone sit pay peace study seem economic.,2025-07-04
1105,300,1,Key administration month ten art.,2025-09-03
1106,456,1,Own much evidence.,2025-02-02
1107,119,1,Sort big true general.,2025-01-30
1108,461,1,Magazine stock mission opportunity summer sister close.,2025-10-03
1109,452,1,Most sell test develop sell as.,2025-09-13
1110,289,1,Game development single alone trade sell it.,2025-10-02
1111,179,1,Power attorney thousand letter rather.,2025-08-27
1112,17,1,Modern remain someone none media.,2025-03-23
1113,454,1,Charge training trade yeah deal city.,2025-03-31
1114,97,1,Still almost protect use.,2025-07-28
1115,352,1,Again several oil today.,2025-06-28
1116,303,1,Pass join different foot.,2025-01-31
1117,450,1,Keep study century court magazine book.,2025-05-13
1118,96,1,Rock off enjoy.,2025-06-20
1119,367,1,House fish minute.,2025-07-05
1120,267,1,Join series audience piece peace.,2025-04-12
1121,187,1,National station scientist over value him.,2025-10-09
1122,292,1,All onto stop cell sister phone.,2025-05-01
1123,145,1,Growth voice case themselves last them me.,2025-10-09
1124,492,1,Region nearly rule especially.,2025-07-29
1125,144,1,Go must fund change partner.,2025-06-07
1126,197,1,Bill expert rock tend I firm line.,2025-01-10
1127,15,1,Name activity source candidate mean scene simply.,2025-10-10
1128,200,1,Argue attack go small key happy cost.,2025-02-19
1129,479,1,Rather central measure figure prevent.,2025-04-30
1130,325,1,Actually many these hold learn economic shake.,2025-01-20
1131,155,1,Recognize Democrat I standard sound put.,2025-06-30
1132,344,1,Region give grow record among during.,2025-02-03
1133,135,1,Bit me believe total east executive.,2025-04-02
1134,439,1,Yes increase company lot spend.,2025-04-28
1135,244,1,Sister growth represent clear line chair.,2025-07-23
1136,435,1,Everybody candidate improve case understand left international.,2025-07-08
1137,476,1,Card mean seem tend investment easy.,2025-05-20
1138,67,1,Window star travel speech never.,2025-04-17
1139,302,1,Once morning history tree.,2025-09-04
1140,286,1,Figure race north difficult develop number effect.,2025-05-21
1141,70,1,Fire PM worry race project goal concern.,2025-10-17
1142,494,1,Game control newspaper evening.,2025-04-24
1143,208,1,Edge final house add relationship no everyone.,2025-09-14
1144,407,1,She call indeed worry then be.,2025-10-01
1145,427,1,Class explain develop trouble quality official.,2025-07-15
1146,24,1,Enough paper help term.,2025-07-27
1147,187,1,Everything maintain perhaps camera turn agency food fast.,2025-07-13
1148,346,1,Company south month truth indeed any let present.,2025-01-24
1149,248,1,Director appear force each serve often she friend.,2025-06-29
1150,314,1,Wide down TV standard foreign sit last event.,2025-06-26
1151,31,1,Born trade management analysis.,2025-05-22
1152,219,1,Natural artist method high.,2025-10-15
1153,22,1,Authority despite sometimes available.,2025-03-19
1154,290,1,Short second so through but relationship.,2025-08-29
1155,142,1,Back community thousand test strategy she consumer.,2025-05-05
1156,211,1,Remember officer stop part.,2025-02-18
1157,310,1,He theory growth guy.,2025-07-18
1158,102,1,Sell article direction small.,2025-01-17
1159,329,1,Name seek good account sound for.,2025-04-11
1160,424,1,Subject find season job option forward man.,2025-08-20
1161,282,1,Hair call eye information.,2025-07-22
1162,291,1,South economic matter operation fast cold piece soldier.,2025-09-18
1163,187,1,Be increase event notice reality another.,2025-03-05
1164,427,1,Before throw share PM nation.,2025-10-11
1165,403,1,Then will perhaps describe half wonder unit.,2025-08-13
1166,463,1,Break effort partner number act.,2025-07-23
1167,398,1,Maybe pretty section wait tend.,2025-08-30
1168,499,1,Cultural either end fire successful positive.,2025-04-03
1169,353,1,Skin another us news start.,2025-10-09
1170,500,1,Per claim team.,2025-10-07
1171,406,1,Fire need no lead southern our century.,2025-06-17
1172,41,1,Thus project production.,2025-08-27
1173,452,1,Month concern source down environmental despite use own.,2025-06-19
1174,367,1,Range forward stock high few leg some.,2025-03-08
1175,30,1,Drop data account responsibility south.,2025-05-18
1176,493,1,Line town account.,2025-09-19
1177,192,1,Way almost realize situation protect building side training.,2025-05-29
1178,333,1,Change just tell might knowledge nor.,2025-05-30
1179,2,1,Safe actually market option project eye building.,2025-02-10
1180,346,1,Check return manage reason house director.,2025-08-17
1181,163,1,Seat scene production take.,2025-07-11
1182,199,1,Conference bed necessary whole region recent.,2025-01-06
1183,233,1,Time manager enjoy majority.,2025-09-04
1184,44,1,Management above way go face.,2025-09-28
1185,109,1,Nearly ask reduce others.,2025-01-27
1186,303,1,Station employee painting arrive tree fund.,2025-06-30
1187,63,1,Yet very moment loss.,2025-01-08
1188,315,1,Mother forget as while.,2025-06-05
1189,61,1,Available as radio modern environmental.,2025-04-30
1190,474,1,Sure peace agency development believe.,2025-06-17
1191,156,1,Many school teacher stock still suffer.,2025-06-08
1192,483,1,Avoid especially city site.,2025-08-16
1193,319,1,Pretty bad take entire idea.,2025-01-23
1194,329,1,Position physical whom partner suffer.,2025-02-22
1195,119,1,Our information interest them wear.,2025-07-12
1196,273,1,Service example represent investment newspaper.,2025-05-20
1197,138,1,How both each spring news.,2025-03-03
1198,371,1,Themselves discussion ask service then door.,2025-09-17
1199,239,1,Radio kid find national performance.,2025-01-26
1200,68,1,Different lot new act.,2025-07-17
1201,239,1,Ground third group together often turn own believe.,2025-04-17
1202,87,1,However machine walk fly defense.,2025-06-13
1203,113,1,Human card best page.,2025-09-04
1204,466,1,Including particularly put.,2025-02-12
1205,3,1,Speak approach describe least own possible of.,2025-08-30
1206,230,1,Material candidate outside three.,2025-04-12
1207,28,1,Pass still reach else save watch.,2025-02-10
1208,127,1,Card weight safe of be sing project.,2025-05-31
1209,24,1,List wrong task compare cup Congress all.,2025-04-23
1210,270,1,Cut audience appear positive age.,2025-09-19
1211,330,1,Natural development grow population.,2025-03-03
1212,269,1,Yes forward student such.,2025-03-31
1213,319,1,Where bring similar TV.,2025-05-08
1214,477,1,City sister tax protect simple generation.,2025-01-10
1215,231,1,Himself lot health.,2025-07-04
1216,330,1,Finally car first.,2025-01-12
1217,264,1,Rest attack beautiful suddenly maintain every Republican.,2025-04-07
1218,396,1,Along spring group make bit market growth sound.,2025-06-12
1219,57,1,Hospital money improve author let yes number.,2025-07-10
1220,227,1,Support main race.,2025-04-19
1221,418,1,Front meeting wish nearly resource often religious parent.,2025-05-26
1222,326,1,Than wife once democratic.,2025-07-17
1223,156,1,Here career air view television.,2025-09-29
1224,20,1,Success front hot reveal reason.,2025-09-28
1225,99,1,Agency response respond state finally.,2025-01-18
1226,285,1,Look here sell still recently mother skill effort.,2025-10-08
1227,283,1,Stop over save couple bring any option TV.,2025-05-23
1228,322,1,Still born during soldier.,2025-06-15
1229,356,1,I general at open marriage star early true.,2025-09-01
1230,294,1,Fund near very into.,2025-07-15
1231,132,1,Hour stuff they foreign short close these.,2025-04-17
1232,360,1,Once choose state wide upon.,2025-07-24
1233,101,1,Sure realize money kitchen sense.,2025-09-02
1234,221,1,Who argue able theory response class.,2025-05-07
1235,458,1,View light wear argue machine hair do American.,2025-07-30
1236,239,1,Provide meeting board among think only many type.,2025-07-11
1237,426,1,Single share arm price drop stay us.,2025-03-10
1238,460,1,Hour near behind simply value.,2025-06-18
1239,322,1,Moment entire purpose late.,2025-07-08
1240,449,1,Side room through professor maybe experience executive.,2025-10-13
1241,132,1,Station determine assume skill eight vote age.,2025-05-27
1242,143,1,Direction important lawyer these leader majority second.,2025-04-14
1243,155,1,Argue important with maybe.,2025-02-07
1244,415,1,White much trial book mouth.,2025-08-03
1245,425,1,Score wear professor much control speech seem.,2025-04-03
1246,414,1,Her every notice compare the stock determine.,2025-03-16
1247,58,1,Bit open about cell.,2025-08-14
1248,184,1,Executive cause other senior section.,2025-10-02
1249,246,1,Popular prove class prevent everyone.,2025-02-16
1250,318,1,Edge like people lose.,2025-04-19
1251,421,1,After open prepare only economic my.,2025-01-22
1252,389,1,Serious apply future spring behavior.,2025-08-03
1253,408,1,Situation police soon there.,2025-04-08
1254,143,1,Choice discuss Republican opportunity letter I.,2025-06-23
1255,430,1,Add hand rather environmental billion sea.,2025-06-30
1256,86,1,Certain case share discuss leave important reality.,2025-05-25
1257,382,1,Each where beautiful tonight age forward.,2025-08-10
1258,499,1,Cold all week PM region member test.,2025-08-27
1259,293,1,Leave bit job spend require pay face.,2025-09-05
1260,231,1,Perform million big job opportunity history evening assume.,2025-08-17
1261,391,1,Paper experience treatment hot.,2025-06-12
1262,411,1,Method no month establish state.,2025-08-26
1263,318,1,Draw eat space plan.,2025-03-12
1264,237,1,Fill actually city tonight policy respond direction.,2025-01-16
1265,499,1,Field around produce produce adult property heart.,2025-02-08
1266,101,1,Congress discussion kitchen year leader education former simple.,2025-03-09
1267,358,1,Here human decide fall.,2025-05-07
1268,249,1,Fire quality last face.,2025-08-13
1269,65,1,One green consider whole phone technology.,2025-09-17
1270,100,1,Unit pay Democrat cultural happen successful together.,2025-02-08
1271,128,1,Actually imagine American Mrs finally try dinner.,2025-09-18
1272,102,1,Candidate accept form safe but.,2025-01-22
1273,12,1,Believe people week skill.,2025-01-31
1274,202,1,Growth reality pressure ability clear accept idea result.,2025-06-21
1275,128,1,Tell can fine specific bad official carry.,2025-07-15
1276,260,1,Skin these agreement free notice.,2025-06-09
1277,364,1,Certainly production that exactly American method member.,2025-01-09
1278,60,1,Usually director fast art tax.,2025-05-04
1279,185,1,Provide part enjoy hear media.,2025-08-18
1280,111,1,Federal eat because table great great close drive.,2025-03-28
1281,231,1,Policy soon option recently ahead consumer company break.,2025-01-19
1282,334,1,Know property baby nation size even.,2025-01-17
1283,373,1,Protect argue girl particular around study especially.,2025-08-31
1284,177,1,Official reduce necessary college build break.,2025-07-12
1285,345,1,Hope author clearly phone upon.,2025-03-07
1286,394,1,Room herself development visit success watch data out.,2025-09-28
1287,460,1,Young level eat begin next enjoy wait.,2025-07-10
1288,283,1,Themselves upon country college.,2025-01-01
1289,154,1,Check field yet business until minute.,2025-08-07
1290,246,1,Always size open great cultural if assume.,2025-09-14
1291,217,1,Physical yes address.,2025-04-20
1292,167,1,Account now particular note wall no.,2025-07-04
1293,432,1,Voice car hard son anything.,2025-07-19
1294,475,1,Chance cup store finally number though.,2025-02-03
1295,407,1,Choice be institution six actually share center.,2025-09-22
1296,8,1,Lose police enjoy on many involve issue.,2025-03-16
1297,196,1,Relationship financial theory.,2025-02-11
1298,351,1,Support decide for glass into author.,2025-10-14
1299,7,1,System run rule whether certain billion.,2025-09-25
1300,459,1,Traditional sound allow real.,2025-06-06
1301,59,1,Suffer whose join level program opportunity method door.,2025-09-27
1302,17,1,Measure along of vote feel child.,2025-04-04
1303,364,1,A why city store individual action marriage.,2025-01-01
1304,199,1,Thus statement since see skill under.,2025-07-07
1305,317,1,National education trade friend.,2025-08-21
1306,435,1,Value toward appear north manager simple likely.,2025-03-23
1307,425,1,Support involve center piece bag remember.,2025-01-24
1308,474,1,Growth dog house force throughout.,2025-04-11
1309,22,1,View season college on very scientist prevent.,2025-08-18
1310,336,1,Exactly civil claim whatever.,2025-01-11
1311,361,1,Leg condition agreement gas skin discussion step.,2025-09-04
1312,370,1,Believe history development.,2025-01-21
1313,61,1,Actually down soldier teach sort hospital.,2025-07-11
1314,258,1,Catch indeed reduce away.,2025-05-25
1315,442,1,Probably election for with.,2025-08-25
1316,121,1,The respond wonder skill who.,2025-10-16
1317,59,1,Same seven movie rock skill image.,2025-04-13
1318,104,1,Population manager past low.,2025-05-03
1319,157,1,Participant lead town defense oil among.,2025-09-08
1320,155,1,Music address include too late land.,2025-05-06
1321,441,1,Likely something spend better stop real price.,2025-08-21
1322,174,1,Throughout clearly perhaps fine it pick crime.,2025-05-28
1323,250,1,Fight add give free agreement itself light.,2025-02-16
1324,444,1,Light live enough.,2025-08-09
1325,151,1,Clearly baby improve to.,2025-05-24
1326,195,1,Recognize go stop receive house spend true.,2025-02-23
1327,454,1,Decade even worry different.,2025-08-19
1328,3,1,Interview center production key interest hand.,2025-04-10
1329,256,1,Other court property throw visit give new respond.,2025-02-24
1330,87,1,Camera government election.,2025-02-14
1331,481,1,By turn price.,2025-05-05
