id,client_id,tenant_id,content,created_at
1332,442,1,Life sign when TV guy.,2025-03-08
1333,329,1,You garden her true structure public.,2025-04-07
1334,248,1,Ever who church.,2025-01-03
1335,30,1,If easy arm you wear coach TV.,2025-07-30
1336,368,1,Forward opportunity himself fall never.,2025-09-17
1337,470,1,Day reason question become foreign matter.,2025-06-09
1338,201,1,Fine side upon put.,2025-06-29
1339,184,1,Chair whom country start maybe major store daughter.,2025-06-30
1340,171,1,Character benefit charge read first suggest against.,2025-02-01
1341,367,1,Value civil staff.,2025-06-03
1342,162,1,Painting Democrat anyone after seven hear sure.,2025-01-02
1343,266,1,Police thing effort beat affect address war.,2025-03-11
1344,309,1,Benefit box likely possible.,2025-06-27
1345,467,1,Kitchen left job play.,2025-08-29
1346,200,1,Authority pick everyone TV buy scene ahead.,2025-02-24
1347,66,1,How say structure where wife.,2025-04-11
1348,180,1,Least table candidate weight yet.,2025-01-20
1349,134,1,Window job rock good fear identify close might.,2025-01-06
1350,358,1,Must song lot answer culture finally.,2025-06-09
1351,57,1,Economic nice small green lose.,2025-02-10
1352,440,1,Tree same next.,2025-08-10
1353,274,1,Magazine perform around style.,2025-08-28
1354,367,1,Debate boy response so way.,2025-04-30
1355,167,1,Police send issue source test investment great.,2025-09-12
1356,225,1,Research very community performance reach.,2025-07-18
1357,464,1,Save off its great note.,2025-05-13
1358,402,1,Control generation listen.,2025-10-16
1359,90,1,Shake forget investment game.,2025-07-17
1360,247,1,Hair few paper he relate point record.,2025-03-01
1361,350,1,Pass plant level rather.,2025-03-19
1362,371,1,Particularly lead hotel single expert still help outside.,2025-01-30
1363,52,1,Actually fire agent add election realize until.,2025-03-29
1364,486,1,Center arm onto trouble.,2025-05-04
1365,141,1,Under type strong choose.,2025-04-21
1366,220,1,Boy growth vote degree upon.,2025-08-26
1367,13,1,End laugh green short.,2025-04-21
1368,112,1,Cold sign article present sure parent us much.,2025-01-26
1369,84,1,Low lead else school friend involve.,2025-01-28
1370,380,1,According election different three here too trial.,2025-10-10
1371,218,1,Later let billion perhaps upon trade sing despite.,2025-03-21
1372,416,1,Wife memory after improve.,2025-10-03
1373,220,1,Amount provide Republican around issue rest image follow.,2025-06-29
1374,417,1,Day official hear probably writer cause hospital.,2025-08-14
1375,487,1,Generation maintain view behind read current term prove.,2025-02-16
1376,329,1,Dog participant part voice easy go chair trouble.,2025-06-15
1377,221,1,Must anything phone report election.,2025-06-17
1378,310,1,Treat somebody task suddenly action.,2025-08-29
1379,425,1,Through magazine fight tough baby.,2025-06-25
1380,425,1,Something institution they school still paper.,2025-07-20
1381,153,1,Usually suddenly thousand everything enter dinner must.,2025-09-08
1382,23,1,Question natural pass daughter offer.,2025-08-20
1383,1,1,Mention low ever card type.,2025-01-14
1384,30,1,Clearly behind speak decide.,2025-05-09
1385,472,1,Husband rock conference argue trial.,2025-03-08
1386,287,1,Certain collection town put history.,2025-09-16
1387,472,1,Discover quite middle turn stop price contain.,2025-08-18
1388,418,1,Oil program most change dark quality case.,2025-04-10
1389,404,1,Town become enjoy world glass firm.,2025-04-01
1390,81,1,Professor sound Democrat cover around.,2025-03-19
1391,21,1,Information water anything series.,2025-08-14
1392,59,1,Authority local follow young machine bad.,2025-06-11
1393,98,1,Collection short deal small back off improve bag.,2025-02-23
1394,303,1,Positive feel PM control option.,2025-05-20
1395,378,1,Structure majority maybe necessary best mission stuff.,2025-06-04
1396,193,1,Garden write manager.,2025-01-07
1397,142,1,Across capital their.,2025-07-05
1398,406,1,Rather city often course light themselves treatment.,2025-02-01
1399,483,1,Population state before team body use.,2025-01-13
1400,205,1,Southern charge music energy take reflect can.,2025-02-03
1401,232,1,Yet training relate if.,2025-07-19
1402,144,1,Data decision north knowledge third thought.,2025-01-21
1403,217,1,Against line information year film exactly system.,2025-01-05
1404,267,1,Next area kitchen book although method theory.,2025-03-13
1405,133,1,Visit politics over heavy toward.,2025-07-02
1406,367,1,Which edge rock sport.,2025-05-09
1407,397,1,Agent least whatever guy bill.,2025-03-26
1408,238,1,Necessary threat American amount fine check popular.,2025-01-11
1409,162,1,Professor particularly central central whole.,2025-04-01
1410,280,1,School program fight.,2025-05-10
1411,428,1,More only but hospital after social.,2025-07-09
1412,493,1,Safe commercial policy need mission.,2025-08-24
1413,21,1,Growth trade design compare everybody there put.,2025-05-17
1414,380,1,House assume different memory like minute work value.,2025-03-14
1415,380,1,Support bad often something concern draw game federal.,2025-07-04
1416,39,1,Sister past now avoid assume outside fly voice.,2025-06-23
1417,199,1,Report message recently.,2025-09-29
1418,476,1,Federal himself own either.,2025-07-15
1419,271,1,Myself race pull party anyone effort.,2025-03-26
1420,479,1,Account Mr court although.,2025-04-23
1421,418,1,Growth also either of research table point.,2025-10-03
1422,86,1,Model list develop career audience reduce.,2025-02-14
1423,227,1,Sense military woman tonight something south.,2025-09-16
1424,174,1,Happen son improve assume.,2025-03-06
1425,455,1,Able energy several plant six its society.,2025-04-16
1426,420,1,Discover bank child.,2025-09-22
1427,170,1,Worry poor I sure maybe relate.,2025-08-13
1428,10,1,Skin attention allow dark mouth collection accept.,2025-04-05
1429,392,1,Public doctor tree only.,2025-08-09
1430,293,1,For another doctor I.,2025-07-25
1431,327,1,Maybe while campaign Democrat reveal little.,2025-09-06
1432,381,1,Especially her reality generation practice class.,2025-07-31
1433,386,1,East price owner inside national.,2025-04-09
1434,81,1,Those clearly ability.,2025-05-22
1435,97,1,According system turn majority son.,2025-07-04
1436,238,1,Explain past a.,2025-09-02
1437,232,1,Which field near word energy.,2025-05-06
1438,393,1,Degree each sometimes their follow nearly.,2025-06-08
1439,233,1,Treatment case thank cultural turn glass five despite.,2025-07-02
1440,460,1,Decision worker customer west.,2025-07-01
1441,297,1,Huge son point ever dog third necessary.,2025-01-03
1442,484,1,Order money sign successful figure operation large.,2025-01-21
1443,148,1,Push act we exactly.,2025-07-08
1444,190,1,Kitchen drive near here simple item same.,2025-09-18
1445,428,1,Room study operation attack.,2025-02-28
1446,226,1,Leader college put surface.,2025-10-18
1447,163,1,Before board according fly.,2025-10-18
1448,189,1,Memory teach word with.,2025-07-12
1449,32,1,Agreement her create race.,2025-04-23
1450,57,1,Whole trade total keep.,2025-08-31
1451,42,1,Now space try participant form evening.,2025-10-08
1452,143,1,Fill last visit.,2025-08-18
1453,286,1,Think remember recognize watch work character day.,2025-01-07
1454,297,1,Woman property red realize water share debate impact.,2025-05-15
1455,284,1,Sell do growth generation free church.,2025-06-12
1456,466,1,Science physical hotel so bad soon data.,2025-02-21
1457,346,1,Practice character wind.,2025-08-07
1458,440,1,Network evening visit each put.,2025-05-26
1459,348,1,Particularly draw particularly production.,2025-09-08
1460,215,1,Add trouble in receive heavy.,2025-07-19
1461,198,1,Debate knowledge miss oil.,2025-01-30
1462,269,1,Structure stand break clearly day.,2025-06-11
1463,71,1,Well and thus close.,2025-01-26
1464,497,1,Glass energy west day sell.,2025-09-18
1465,49,1,Top class stuff region.,2025-04-26
1466,81,1,Hundred station technology notice prove tend learn.,2025-08-08
1467,246,1,Soldier social short safe.,2025-03-22
1468,9,1,Thus he own care wall reduce material.,2025-05-14
1469,280,1,Religious study plan in.,2025-04-27
1470,407,1,Wall each beyond finally party.,2025-03-02
1471,439,1,Stage situation allow care decision.,2025-02-21
1472,174,1,Yourself choose expert three difference.,2025-09-25
1473,327,1,Detail reach none onto choice.,2025-09-20
1474,165,1,Plant old discover why anything.,2025-10-01
1475,229,1,Step eight career little dark people.,2025-06-13
1476,295,1,Leader car food personal above compare participant.,2025-01-13
1477,285,1,Dinner evidence star else sit ball.,2025-06-09
1478,439,1,Hand so realize radio then weight.,2025-05-02
1479,109,1,Hundred water full themselves.,2025-03-04
1480,138,1,List owner station court kind see.,2025-05-20
1481,86,1,Face scientist treatment assume.,2025-02-14
1482,112,1,Travel whom pull seem before anything.,2025-01-11
1483,322,1,Thought indicate follow hard foreign unit result.,2025-04-25
1484,58,1,Go may marriage upon catch.,2025-07-27
1485,299,1,Line each turn color officer size star manager.,2025-07-31
1486,25,1,Return TV bag.,2025-03-10
1487,228,1,Lose purpose require population college city.,2025-01-25
1488,420,1,Term one almost popular energy.,2025-04-11
1489,159,1,Herself maybe dog summer decide rest statement prepare.,2025-03-12
1490,378,1,While produce draw follow weight newspaper clearly anyone.,2025-01-29
1491,383,1,Hour watch happen floor place in.,2025-07-27
1492,458,1,Hard more walk job.,2025-06-14
1493,420,1,Blue include letter art item officer a.,2025-06-21
1494,34,1,Gun general enjoy single practice.,2025-08-03
1495,202,1,Matter message price bring full box protect.,2025-02-17
1496,216,1,Specific choose recognize.,2025-03-11
1497,269,1,Consumer idea hotel able throw me doctor.,2025-04-23
1498,128,1,Rich off month live significant population reflect expert.,2025-10-03
1499,176,1,Cut many education chance.,2025-09-04
1500,442,1,Sense artist through stuff worker.,2025-02-16
