id,client_id,tenant_id,content,created_at
1,360,1,Check prepare trial street pick throw.,2025-04-07
2,275,1,Hard prevent no professional.,2025-08-01
3,227,1,Cut effect approach concern modern front for.,2025-06-30
4,297,1,Skill true page someone option rest skill.,2025-07-14
5,21,1,Full blue determine financial different suggest.,2025-04-29
6,43,1,Rule exist drive decision.,2025-06-01
7,162,1,Edge want mean table defense before land full.,2025-08-05
8,93,1,Onto brother better source.,2025-06-29
9,267,1,Military push lose yes its.,2025-10-10
10,272,1,Life important bad be common any chair.,2025-04-08
11,187,1,How number successful guess check that color owner.,2025-01-12
12,362,1,Phone product conference time.,2025-04-11
13,333,1,Pass specific nearly by bed.,2025-05-18
14,233,1,Service company thousand leave a upon relationship.,2025-02-18
15,380,1,Future always probably should word address.,2025-04-25
16,463,1,Government expect may near guy perform because.,2025-07-07
17,321,1,Relate pretty not white fire.,2025-09-26
18,302,1,Indeed development thought hospital feel choice.,2025-08-12
19,43,1,South impact reveal theory throughout.,2025-07-24
20,455,1,Establish join step process.,2025-10-02
21,292,1,Sometimes director gun source try hotel.,2025-07-11
22,47,1,Employee suddenly his everyone.,2025-01-09
23,379,1,Collection condition soldier him.,2025-10-13
24,361,1,Lay guess tree.,2025-07-23
25,228,1,Party point pick everybody usually environment weight too.,2025-04-21
26,229,1,Eye lose party because sister fear.,2025-04-13
27,138,1,Town edge west movie.,2025-06-24
28,38,1,Government rise street right responsibility have sing.,2025-02-28
29,24,1,Indeed hand huge none.,2025-09-16
30,178,1,Especially language expert full open.,2025-10-04
31,222,1,Heavy left deal local security hour.,2025-03-19
32,308,1,Leave move compare his myself provide sure.,2025-01-02
33,344,1,Thus hold same lawyer visit bill three expect.,2025-02-06
34,215,1,System article worry try senior minute.,2025-08-09
35,362,1,Election author offer whatever.,2025-03-24
36,131,1,Include since discuss school deal hour want.,2025-05-17
37,182,1,Three house southern become before bad.,2025-05-26
38,263,1,Production energy particular not billion better.,2025-05-29
39,439,1,Sit seat explain really.,2025-08-13
40,220,1,Sort figure care religious truth environment forget people.,2025-09-18
41,82,1,Myself commercial month price listen.,2025-05-26
42,458,1,Important pressure those have maintain him.,2025-09-14
43,418,1,True between their not surface consider.,2025-05-23
44,469,1,And way top think market grow indicate.,2025-09-15
45,135,1,Over hotel lose might eye.,2025-08-05
46,30,1,Middle letter fly us.,2025-05-21
47,321,1,Worker success thing follow say mind house arrive.,2025-06-09
48,452,1,Far time send quickly happy detail.,2025-06-13
49,312,1,Wide assume professional.,2025-06-22
50,22,1,Middle ball grow policy.,2025-07-12
51,439,1,Month close Mrs firm reveal.,2025-07-22
52,420,1,Now bring two bad outside lead car me.,2025-08-09
53,309,1,Affect maybe interesting sing some benefit medical.,2025-04-07
54,490,1,Word rather never.,2025-09-11
55,227,1,Center lead line worker perform front conference.,2025-02-01
56,435,1,Activity later inside ten discover certainly.,2025-09-28
57,103,1,White attention line war bag seven.,2025-08-19
58,347,1,Recognize main cover total.,2025-01-25
59,389,1,Indeed call we similar product think yes.,2025-07-26
60,307,1,Wish low key population interest expect side.,2025-03-14
61,496,1,Growth recent require subject until.,2025-08-09
62,278,1,Message pay foreign tax lead herself best.,2025-07-15
63,335,1,Option grow fire open reason.,2025-07-25
64,383,1,Discussion resource since either base here nothing.,2025-09-17
65,162,1,Group peace never audience help voice.,2025-06-12
66,363,1,White firm environmental sister consumer range party say.,2025-03-06
67,434,1,News audience report political later public.,2025-05-23
68,336,1,How your member impact include property.,2025-08-12
69,283,1,Fall past team two exist likely event.,2025-06-09
70,214,1,Parent environmental coach perhaps occur series.,2025-08-29
71,29,1,Key sea his ground fear memory.,2025-02-16
72,482,1,Gas card blood town table role him.,2025-07-29
73,428,1,More realize source claim skill body player.,2025-05-20
74,26,1,Last a policy assume kid.,2025-07-28
75,274,1,Road sense wonder process a.,2025-04-21
76,198,1,Watch region black.,2025-09-29
77,92,1,Themselves story reason record subject water impact.,2025-10-18
78,16,1,When much society role right.,2025-09-10
79,401,1,Record east while edge.,2025-04-10
80,209,1,Capital performance allow.,2025-05-28
81,325,1,Interview less outside kitchen second thought true share.,2025-04-26
82,122,1,Arrive side life maybe available affect indeed.,2025-01-17
83,220,1,Movement throughout common grow someone.,2025-06-08
84,304,1,Coach must for learn better.,2025-05-13
85,291,1,Institution avoid activity cover card.,2025-03-31
86,103,1,Almost religious last someone three room.,2025-01-11
87,192,1,Cold assume travel win likely a.,2025-09-05
88,238,1,Physical yeah address sign yet likely.,2025-08-05
89,38,1,Store any rather south hold interesting development.,2025-06-18
90,55,1,Memory create wall small total.,2025-02-18
91,182,1,Result land wind court just skin.,2025-08-05
92,408,1,Real into single organization in deal thing.,2025-09-18
93,473,1,Not without her teacher.,2025-06-27
94,401,1,Ahead trial create him conference marriage.,2025-04-19
95,146,1,Table plan citizen finally generation rule.,2025-10-12
96,312,1,Others little list claim cost measure national.,2025-03-03
97,58,1,But plant game admit do science human.,2025-04-14
98,290,1,Language forward new market.,2025-09-14
99,109,1,Begin television nature put total event.,2025-04-12
100,237,1,Player glass public education society may.,2025-06-13
101,125,1,Usually message officer class.,2025-02-11
102,497,1,Own treat anyone spend business.,2025-02-07
103,427,1,Develop onto strong.,2025-01-19
104,92,1,Represent another old note current.,2025-09-24
105,248,1,Whether wonder conference recognize listen success.,2025-04-14
106,170,1,Wear rate somebody fill various himself.,2025-09-19
107,286,1,Adult simple physical choice laugh word history.,2025-06-10
108,200,1,Down fire course career.,2025-08-17
109,283,1,Responsibility newspaper improve billion.,2025-10-11
110,227,1,Daughter hard change despite third wall turn.,2025-09-13
111,183,1,Stuff agree building answer discussion.,2025-09-27
112,426,1,Challenge management American soldier.,2025-01-10
113,468,1,Town simple history discussion item.,2025-08-31
114,260,1,Record reason consider suddenly.,2025-02-17
115,437,1,Personal exist particular expect.,2025-10-02
116,200,1,Customer civil series forward term else.,2025-09-01
117,263,1,Term impact old seek wish reality candidate.,2025-07-19
118,7,1,Significant decide short major offer care my floor.,2025-07-30
119,398,1,Yet than tell marriage.,2025-07-04
120,207,1,Recent increase former impact decide image bit.,2025-01-24
121,147,1,Spend kitchen style provide charge tell lay make.,2025-03-26
122,24,1,Ten reflect plan take.,2025-10-08
123,309,1,Make or time over though run as.,2025-08-01
124,199,1,Society training rate painting.,2025-04-20
125,173,1,Seem give American.,2025-04-24
126,427,1,Enjoy exist along figure indicate attack.,2025-07-16
127,52,1,Industry receive yes help against hit least.,2025-10-18
128,499,1,Wear parent usually feel kid eight.,2025-05-21
129,129,1,Through owner see choice production best son.,2025-07-01
130,145,1,Life tonight show enough show.,2025-07-25
131,459,1,Away society career less respond.,2025-05-01
132,421,1,Short seat long region claim short.,2025-08-20
133,431,1,Billion reach address art kitchen whose in.,2025-04-12
134,442,1,Job that subject true ready task imagine.,2025-09-22
135,214,1,Stay Congress nation author low.,2025-02-21
136,238,1,Three indeed senior play serve life project.,2025-09-04
137,164,1,Development network third level whatever kitchen out.,2025-10-11
138,232,1,Program practice create minute leg score.,2025-06-26
139,220,1,Own middle wait beautiful away rest later.,2025-01-28
140,80,1,Fact challenge out least government next.,2025-07-16
141,140,1,Finally while know serious.,2025-03-28
142,23,1,Hair student few audience federal feeling.,2025-06-11
143,69,1,Consider nice operation.,2025-01-08
144,150,1,Expect few go size dream plant interest.,2025-09-17
145,242,1,Look training article economic race.,2025-01-14
146,483,1,Special save type describe new.,2025-02-03
147,94,1,Brother level most health summer great through spring.,2025-10-10
148,208,1,Interview glass laugh along live while.,2025-03-22
149,435,1,Surface think music there difference often society deal.,2025-09-18
150,247,1,Cover north knowledge south ground research exist people.,2025-07-04
151,375,1,Before professional book feel Mr.,2025-02-09
152,60,1,Leg adult computer.,2025-05-03
153,355,1,Maintain food mission best around rate actually.,2025-07-05
154,377,1,Wall method world defense city physical.,2025-03-19
155,212,1,Else sign body song civil talk until.,2025-02-18
156,436,1,Boy war both find candidate president.,2025-07-07
157,482,1,Society wonder exactly very behind various.,2025-08-27
158,481,1,Family bar trade learn beyond wide travel.,2025-04-25
159,329,1,Very dark a.,2025-02-20
160,368,1,Strategy analysis magazine use worry.,2025-03-01
161,30,1,Property pass risk attention usually.,2025-04-28
162,364,1,Since various off project policy court party.,2025-06-06
163,113,1,Audience history medical very serve option top.,2025-01-25
164,196,1,Discover past seven whether everyone available brother.,2025-01-02
165,159,1,Scene store fund first debate health.,2025-07-11
166,123,1,As happy serious speak create management matter.,2025-04-26
167,325,1,Too deal fire series.,2025-03-17
168,245,1,Beyond certain remain south.,2025-03-19
169,492,1,Against buy often nor.,2025-06-19
170,398,1,Suffer her key seven church story.,2025-07-01
171,318,1,Though age window wife.,2025-04-25
172,75,1,Purpose reflect suggest kind travel quickly tell.,2025-09-06
173,412,1,Accept modern community.,2025-01-15
174,169,1,Tax thousand culture picture window always.,2025-01-15
175,42,1,Increase parent whether father social.,2025-06-05
176,188,1,Blue morning stop into occur military.,2025-01-31
177,322,1,Husband computer on near.,2025-06-05
178,178,1,Yes people federal financial care land amount ability.,2025-05-19
179,310,1,Respond ready letter economic.,2025-01-12
180,222,1,Parent face sea.,2025-04-27
181,285,1,Perhaps experience military talk so state.,2025-08-13
182,380,1,Also article new part pretty organization approach all.,2025-09-20
183,394,1,Measure similar think fall few investment take itself.,2025-06-03
184,222,1,Goal candidate indeed behavior cup.,2025-09-02
185,471,1,Shake choice seat energy reflect scene security.,2025-06-18
186,317,1,Year but gas group.,2025-09-05
187,128,1,Recently drop item.,2025-07-21
188,440,1,Put cover figure best take population.,2025-03-26
189,328,1,Wrong by step million staff mouth.,2025-02-05
190,448,1,Local reach decade hit.,2025-07-30
191,139,1,Make image traditional simple allow thank recently financial.,2025-04-24
192,197,1,Glass and yet civil summer one.,2025-02-16
193,449,1,Against very dog wrong individual once.,2025-04-07
194,215,1,Manage end suggest product life information.,2025-04-20
195,3,1,Always avoid wrong center apply focus drop.,2025-09-30
196,182,1,Southern politics could address natural.,2025-05-13
197,351,1,Let we outside American above difference dinner.,2025-02-28
198,308,1,Article probably about sit.,2025-07-30
199,463,1,Coach require according road blue.,2025-07-07
200,472,1,Money federal explain.,2025-10-07
201,285,1,Onto partner store bar month.,2025-07-25
202,226,1,Lot find great with mention every.,2025-01-29
203,185,1,Art or place them across feeling cold.,2025-09-20
204,233,1,Board somebody model parent bank.,2025-04-27
205,55,1,Plant simple provide economy rather Mr support top.,2025-01-24
206,57,1,About option spend employee that.,2025-07-27
207,128,1,No close deal deal especially thought.,2025-08-31
208,132,1,Reflect bank movie late.,2025-07-23
209,157,1,Hotel him card later forward though sign.,2025-02-14
210,434,1,Natural room what each.,2025-07-18
211,216,1,Entire lose morning whom since.,2025-02-04
212,19,1,Prevent create inside skill hour energy meet board.,2025-05-16
213,267,1,Weight operation six deal improve window specific.,2025-05-13
214,63,1,Identify market fly manager.,2025-01-19
215,189,1,Down whole defense begin debate two.,2025-07-10
216,50,1,Ok that fear benefit blood.,2025-03-08
217,34,1,The home picture itself.,2025-07-24
218,493,1,Stand now finally organization season always safe.,2025-05-10
219,24,1,Difference beyond factor meet against order it.,2025-05-27
220,478,1,Position whole threat magazine.,2025-05-17
221,486,1,Reach memory attorney despite.,2025-06-29
222,44,1,Treat create could several discover.,2025-09-23
223,280,1,Maybe play bad project view east finally.,2025-04-06
224,266,1,Month four institution art.,2025-04-15
225,297,1,Camera yourself fear model be.,2025-03-12
226,415,1,Consumer everybody opportunity eat.,2025-05-14
227,39,1,Beat place network officer huge.,2025-02-03
228,105,1,Rate central Mrs article song computer professor away.,2025-10-01
229,164,1,Without child maintain blood we.,2025-08-09
230,10,1,Control allow personal security.,2025-09-11
231,179,1,Skill call structure off.,2025-05-11
232,257,1,Suddenly accept peace hold meeting none building dark.,2025-09-02
233,105,1,Difference this between company eight hotel check.,2025-06-30
234,482,1,Picture process a.,2025-02-07
235,495,1,National address fine road sing western forget.,2025-07-06
236,299,1,Reach hundred foreign budget look guess sell.,2025-03-17
237,196,1,Have poor weight safe fund everybody write artist.,2025-05-25
238,46,1,Similar address both on school.,2025-08-19
239,213,1,Goal public worry difficult herself.,2025-08-16
240,375,1,Push firm answer news either few arrive follow.,2025-07-02
241,448,1,Way ready situation my night.,2025-07-09
242,286,1,Camera read nice reach.,2025-09-09
243,347,1,Practice your reality put cold put medical enjoy.,2025-07-01
244,60,1,Blue about present business full ask which.,2025-03-27
245,70,1,Federal when my part guy.,2025-06-28
246,393,1,General describe administration pretty thousand kind.,2025-08-27
247,241,1,Arm make major rate.,2025-03-10
248,456,1,Address spring certain seat determine image change.,2025-10-15
249,133,1,Cultural example toward.,2025-04-22
250,365,1,Place customer they resource.,2025-06-28
251,132,1,Range chair century what pick year maintain.,2025-10-05
252,336,1,Nearly goal wind camera customer hope.,2025-08-24
253,75,1,Form general pattern bed prevent operation people away.,2025-06-16
254,381,1,Probably simple soldier wear thing respond.,2025-01-24
255,187,1,Short others man well.,2025-07-18
256,20,1,Word around least sister field expert.,2025-03-13
257,204,1,Left relate less able marriage offer.,2025-05-31
258,45,1,Line however computer.,2025-03-09
259,472,1,Play forward they able.,2025-04-22
260,190,1,Guy probably pretty will finish hair.,2025-03-08
261,405,1,All together since investment across.,2025-03-07
262,362,1,Language social education morning everyone certain little.,2025-07-20
263,152,1,Assume big third particularly.,2025-09-25
264,79,1,Available interest campaign tax.,2025-02-05
265,73,1,Occur before spend could cause.,2025-05-23
266,451,1,Turn quality exactly gas.,2025-08-21
267,355,1,Feel herself student occur certain.,2025-09-16
268,344,1,Us sure lose.,2025-02-09
269,222,1,None join compare act.,2025-07-16
270,7,1,Personal television threat from feel final just.,2025-01-31
271,334,1,Or ago forget pay floor then.,2025-06-23
272,269,1,Piece fall hotel serious easy camera.,2025-07-24
273,83,1,Argue true yes.,2025-02-02
274,292,1,Serious support improve result defense become month.,2025-04-14
275,115,1,Physical bag present garden enough career.,2025-07-29
276,431,1,Type there there meet within big.,2025-05-10
277,327,1,Site need hotel Congress near customer.,2025-08-24
278,291,1,Better yet minute coach drop.,2025-06-20
279,264,1,Town baby career none.,2025-02-24
280,4,1,Region drop final exist allow theory he training.,2025-08-31
281,486,1,Reduce control too of which north hand.,2025-04-21
282,323,1,Situation movie time quite early.,2025-01-05
283,164,1,Book live natural always.,2025-08-27
284,98,1,Support according series they anything wrong model.,2025-01-18
285,338,1,Long foot idea knowledge accept might major.,2025-02-03
286,194,1,Action right author college color.,2025-03-01
287,267,1,Share director kind everyone.,2025-08-29
288,381,1,Water put far black develop for.,2025-02-27
289,135,1,Scientist either even responsibility myself.,2025-04-03
290,352,1,Share guy write loss.,2025-08-01
291,297,1,Alone such develop.,2025-05-31
292,443,1,Tv local individual.,2025-09-20
293,431,1,Imagine treat eye staff grow.,2025-07-31
294,384,1,Actually serve look kitchen.,2025-04-29
295,375,1,Feel to check share building.,2025-07-13
296,479,1,Ability actually receive support office agent.,2025-03-31
297,231,1,Behind indicate institution important.,2025-01-29
298,52,1,Image some either garden open husband.,2025-05-27
299,399,1,Quality trade wrong yourself truth peace.,2025-01-10
300,156,1,Teach evidence few instead safe table.,2025-03-28
301,188,1,Do none compare put born law apply.,2025-06-06
302,239,1,Whose plan work model amount clearly front baby.,2025-05-24
303,70,1,Nature then once office short.,2025-08-24
304,442,1,Rich word despite current magazine.,2025-02-02
305,433,1,Attorney most others industry.,2025-04-27
306,233,1,Indicate heavy office require up rest.,2025-09-23
307,454,1,Plan pay situation maintain question life never.,2025-02-24
308,368,1,Yes mission happen country current.,2025-03-30
309,373,1,Cause computer final federal hit claim.,2025-10-07
310,32,1,Us total rich middle individual lay read.,2025-04-17
311,350,1,Risk just pattern recent sport director trial purpose.,2025-05-02
312,178,1,Business nothing least room relationship.,2025-06-08
313,403,1,Experience by report more last budget born.,2025-08-15
314,235,1,Author likely site explain article must open there.,2025-04-05
315,440,1,Feel provide government fall himself poor.,2025-03-06
316,362,1,Product vote save everything quickly know.,2025-04-07
317,7,1,Entire value compare run.,2025-09-11
318,111,1,East type production single student fast rise.,2025-02-22
319,277,1,Than every too speak let reach fast.,2025-02-04
320,420,1,Professor trouble same not debate affect against.,2025-02-28
321,159,1,Wear radio home whether.,2025-09-10
322,129,1,Could present anyone his growth later song.,2025-08-11
323,46,1,Step every couple enjoy would manager generation.,2025-03-29
324,357,1,Property word support fact.,2025-09-28
325,354,1,Event medical produce value church style.,2025-04-29
326,84,1,Marriage doctor front individual.,2025-09-10
327,151,1,Continue hard resource.,2025-02-16
328,148,1,Company agree five watch mother.,2025-01-24
329,239,1,Hit Republican just its ball.,2025-05-18
330,144,1,Across director born during same see.,2025-05-21
331,195,1,Police let bed those.,2025-08-24
332,310,1,Others spring drop respond.,2025-04-03
333,108,1,Force first more well media when.,2025-05-31
334,128,1,Skill easy rather.,2025-05-23
335,435,1,Issue response top piece shake goal.,2025-05-08
336,489,1,Race camera bill goal change lead.,2025-07-10
337,458,1,Day quickly recognize because magazine box report.,2025-03-16
338,167,1,Week describe increase do.,2025-07-23
339,304,1,Bank account security.,2025-08-18
340,361,1,Available develop explain.,2025-10-14
341,408,1,Bring positive reason hospital upon degree identify before.,2025-01-28
342,278,1,Site response station according.,2025-06-19
343,250,1,Someone party on born history whole three.,2025-08-29
344,401,1,Money inside nor final.,2025-06-14
345,339,1,Him without focus approach structure adult open.,2025-09-20
346,140,1,Hundred material down research indicate growth watch thank.,2025-05-21
347,89,1,Understand executive win shoulder.,2025-02-15
348,379,1,Production TV although collection level.,2025-08-19
349,232,1,Instead water run memory.,2025-08-23
350,59,1,Agent once home time.,2025-06-03
351,411,1,Final north become moment for.,2025-09-16
352,112,1,Public war letter improve career pull city.,2025-08-12
353,457,1,Knowledge challenge treatment act play paper.,2025-06-29
354,411,1,Address under for time black.,2025-02-07
355,102,1,Network large eat race.,2025-03-26
356,74,1,Suffer voice whether.,2025-07-26
357,144,1,Where write stand same.,2025-04-14
358,46,1,Cause discover modern nothing social about already.,2025-03-06
359,409,1,Glass early collection year window we whole high.,2025-03-04
360,42,1,Fire former onto memory put deal.,2025-01-01
361,89,1,Cause college much husband both begin history.,2025-01-30
362,310,1,Concern citizen seek pull partner answer.,2025-03-01
363,104,1,Born camera though public rock arrive describe.,2025-10-09
364,380,1,Decision society inside decision moment ahead.,2025-06-07
365,302,1,Take I prove against.,2025-04-24
366,383,1,Size next network father.,2025-02-12
367,61,1,College home hit miss.,2025-06-05
368,202,1,Ago shoulder president financial serious expert financial.,2025-07-01
369,162,1,My cut plan whose different table strategy.,2025-07-05
370,395,1,Feel agree industry way great draw outside once.,2025-06-17
371,255,1,Under animal what feel set hour now.,2025-01-01
372,363,1,Too turn its.,2025-08-27
373,387,1,During person hair president career alone think.,2025-08-30
374,450,1,Health who us quite also.,2025-05-14
375,37,1,Six material five this vote medical more.,2025-06-09
376,238,1,Low own clear skin structure defense.,2025-08-29
377,39,1,Whole cause senior discussion year difference.,2025-09-25
378,383,1,Gun special relate.,2025-08-19
379,20,1,Million loss impact area.,2025-08-20
380,468,1,Tell across sell for term trial weight.,2025-06-05
381,65,1,Son few enter.,2025-04-23
382,48,1,Identify might or adult performance future inside poor.,2025-01-02
383,176,1,Coach great garden politics same believe human.,2025-09-24
384,488,1,Cover not speak contain easy.,2025-04-19
385,467,1,Hope over life miss.,2025-03-24
386,379,1,Maybe well third note nor able wear.,2025-02-07
387,466,1,Pattern letter happen Congress maintain.,2025-10-05
388,381,1,Available of tree herself.,2025-07-13
389,410,1,Loss culture officer I star sea.,2025-08-14
390,463,1,Trial individual stay service hundred these model.,2025-08-03
391,133,1,Choose him goal.,2025-06-17
392,39,1,Specific right week option break mean money.,2025-04-05
393,220,1,Notice class player win artist.,2025-02-18
394,232,1,Throw capital hope society.,2025-04-11
395,438,1,Assume bad employee explain.,2025-07-19
396,499,1,We relationship decade both support.,2025-08-04
397,404,1,Anyone policy process development whole however.,2025-02-23
398,444,1,Between drug week represent office white not.,2025-05-17
399,106,1,Few among final into nature a.,2025-08-17
400,133,1,Money throughout attention herself school machine reality.,2025-06-19
401,425,1,Itself bag step.,2025-05-31
402,479,1,New good industry question physical get family.,2025-01-28
403,342,1,Can last exactly site.,2025-10-14
404,414,1,Up officer fill list style industry.,2025-01-07
405,177,1,Face determine role hair.,2025-03-19
406,147,1,Address class charge feeling deep may.,2025-03-02
407,269,1,Serious hotel population focus relationship plan far above.,2025-09-06
408,123,1,Teach inside into total song appear.,2025-08-11
409,188,1,Product practice heavy seem prepare answer.,2025-07-03
410,270,1,Woman simple able gas fact.,2025-07-15
411,183,1,Commercial adult base drop.,2025-06-26
412,395,1,Protect concern model.,2025-08-04
413,285,1,Grow customer situation material same.,2025-03-28
414,99,1,Between medical executive.,2025-07-09
415,370,1,Record around become somebody enjoy early hair.,2025-09-13
416,176,1,Language leave evening remember collection leave bar theory.,2025-03-31
417,291,1,Hold before movie.,2025-09-05
418,41,1,Suggest hospital around TV station project read success.,2025-06-04
419,427,1,Stop think indeed whatever each early.,2025-08-06
420,112,1,Former machine speech suggest during really style win.,2025-07-07
421,357,1,Idea many the wrong blood around that.,2025-06-06
422,2,1,Quality mother approach partner her themselves.,2025-04-07
423,376,1,Community race data indicate then.,2025-04-07
424,209,1,Plan movement institution east together something.,2025-04-11
425,154,1,Significant world pass above board four learn.,2025-01-20
426,340,1,Imagine nation everything thus when.,2025-02-04
427,273,1,Chair issue own themselves.,2025-04-22
428,249,1,Project might player.,2025-03-13
429,336,1,Exist medical likely scientist into.,2025-02-14
430,163,1,Identify game yeah eat.,2025-05-27
431,252,1,Pressure word hotel may wish different hot treat.,2025-01-03
432,483,1,Scientist I bill.,2025-02-03
433,39,1,Sometimes relationship social response degree visit item early.,2025-08-25
434,188,1,Four within but reflect better.,2025-09-01
435,224,1,None treatment accept need heart soon organization bag.,2025-02-10
436,221,1,Describe weight year set.,2025-05-15
437,242,1,Minute north tax ball.,2025-10-13
438,68,1,Understand politics assume ever executive return media.,2025-01-27
439,164,1,Simply together scientist happy live.,2025-04-03
440,37,1,Total good with law gun week.,2025-10-15
441,432,1,Dream no church result.,2025-05-10
442,81,1,Investment indicate carry agree reach themselves.,2025-08-05
443,151,1,Then truth area herself write leader.,2025-02-19
444,489,1,Practice final others quality or.,2025-07-27
445,3,1,Argue factor store today.,2025-02-08
446,49,1,Senior marriage age prepare group poor blood.,2025-03-26
