id,client_id,tenant_id,content,created_at
447,134,1,Speech per edge help however hundred.,2025-04-19
448,284,1,Effect prove sister discussion.,2025-06-22
449,349,1,Technology happy until edge.,2025-01-21
450,125,1,Tell true why reduce.,2025-03-18
451,114,1,Lawyer subject rule item notice.,2025-01-11
452,119,1,Too ball energy education difficult choose natural.,2025-09-11
453,241,1,Responsibility agree dinner together important check.,2025-01-18
454,248,1,Real military deal level.,2025-04-24
455,104,1,Them claim me place measure.,2025-05-29
456,432,1,Become follow western charge together.,2025-09-20
457,178,1,Financial even sing life form.,2025-01-16
458,385,1,Challenge them people explain wonder you.,2025-10-04
459,133,1,Medical thousand hundred fear voice personal fill.,2025-02-18
460,155,1,Case skill boy air group show school.,2025-04-26
461,296,1,Cup identify whose tough imagine game center.,2025-08-01
462,156,1,Force speech evidence opportunity town size treatment.,2025-08-12
463,331,1,Letter final large bit direction agency house instead.,2025-09-30
464,324,1,Tax into shake reach do red half staff.,2025-05-17
465,3,1,Eye enter tell rich nor green.,2025-03-07
466,414,1,Where part assume world fish know popular.,2025-03-03
467,184,1,Feeling according enjoy describe.,2025-03-11
468,80,1,Leave religious ago baby.,2025-05-05
469,18,1,Detail civil defense step out whose.,2025-07-18
470,432,1,Develop statement too despite show.,2025-08-29
471,386,1,Assume manage everybody.,2025-02-03
472,382,1,Because truth yet.,2025-06-27
473,410,1,Catch theory to crime.,2025-03-28
474,283,1,Understand carry sing range.,2025-08-14
475,119,1,Yard catch pattern Congress.,2025-01-31
476,370,1,Fear through together worker some call.,2025-09-12
477,2,1,Machine people explain.,2025-06-24
478,158,1,Weight foot wear.,2025-09-01
479,275,1,Cost item camera moment environment cup stage.,2025-02-07
480,37,1,Heavy cost talk his.,2025-02-13
481,202,1,Who street industry eat might operation girl.,2025-04-06
482,500,1,Human it become doctor low type start.,2025-06-21
483,238,1,Describe anyone heavy debate high.,2025-08-11
484,70,1,Opportunity high stuff box serve your majority.,2025-05-11
485,329,1,Choice line page upon.,2025-04-28
486,397,1,Win animal manager activity.,2025-01-23
487,41,1,Animal site specific.,2025-04-18
488,169,1,The section drop perform.,2025-03-30
489,423,1,Strong chair alone them.,2025-03-17
490,282,1,Property thus structure life anyone type.,2025-03-02
491,45,1,Again energy customer later cold participant.,2025-06-25
492,172,1,Smile nature what week customer do.,2025-02-16
493,146,1,Compare bag important idea.,2025-07-12
494,277,1,Top approach common camera occur create.,2025-05-03
495,234,1,Painting sometimes remember practice turn type program.,2025-09-19
496,242,1,Improve street understand lot.,2025-08-08
497,396,1,Spring light least friend always north Mrs finally.,2025-05-28
498,248,1,Fly institution develop term.,2025-08-29
499,105,1,Would close career team catch television operation pay.,2025-07-22
500,300,1,Day business quickly knowledge success condition marriage.,2025-06-04
501,186,1,Nearly ability board throw four.,2025-07-21
502,305,1,School free meeting wish PM anything sing.,2025-06-05
503,118,1,Bad western space peace evening.,2025-04-29
504,110,1,Save these every guess debate one else.,2025-05-13
505,32,1,Peace various alone pretty letter prepare.,2025-02-26
506,388,1,Property require head standard president difference leader.,2025-03-26
507,181,1,Enjoy sound score budget they.,2025-05-05
508,27,1,Election race very wind.,2025-04-29
509,322,1,Buy performance heavy threat laugh seek whether.,2025-01-26
510,56,1,Peace whole lead should.,2025-02-27
511,191,1,How pretty human structure cover.,2025-09-04
512,56,1,System region watch hope song stuff how education.,2025-05-08
513,374,1,Forward bed example plan my.,2025-05-13
514,13,1,Policy life we argue behavior ahead speech treat.,2025-05-25
515,176,1,Will south give room.,2025-04-20
516,44,1,Summer course people back head move.,2025-07-14
517,257,1,Arrive without imagine charge.,2025-04-05
518,62,1,Chance player form people toward easy leader.,2025-05-20
519,140,1,Technology impact let garden four fact.,2025-07-03
520,361,1,Eat out officer who alone throw.,2025-03-19
521,77,1,Pull store kind beyond.,2025-10-03
522,49,1,Some here something language lead audience do.,2025-02-16
523,267,1,Season meet well measure check wrong bed.,2025-05-31
524,415,1,Involve very area seat local.,2025-09-18
525,35,1,Above teach yourself over weight.,2025-09-30
526,386,1,First part grow run past watch.,2025-05-07
527,157,1,See huge could out almost issue.,2025-02-13
528,81,1,Bill dinner different rise house painting source interesting.,2025-02-27
529,331,1,Movie defense address too consider.,2025-07-21
530,110,1,Born ask goal.,2025-06-16
531,442,1,Wall walk market really series.,2025-05-07
532,400,1,Site significant the.,2025-01-09
533,104,1,Involve imagine very leave head.,2025-05-06
534,12,1,Effect commercial baby money.,2025-09-08
535,73,1,After site well too into Congress end firm.,2025-01-02
536,1,1,Education laugh difficult such soldier think.,2025-02-28
537,89,1,Cultural herself center church rise learn.,2025-10-01
538,175,1,Plan nice interest customer must society how.,2025-09-30
539,50,1,Early movement forget.,2025-01-23
540,142,1,Service task big national hotel.,2025-07-14
541,29,1,May clearly protect card seven here.,2025-02-13
542,137,1,Population recent east Congress window.,2025-07-22
543,109,1,Goal should though budget both.,2025-03-03
544,19,1,Especially without agree single.,2025-04-15
545,247,1,Only wind exactly race surface court instead.,2025-07-09
546,61,1,Artist tend partner television.,2025-08-07
547,230,1,While go boy Republican place mean.,2025-09-12
548,193,1,Miss media camera majority eat past kitchen.,2025-04-29
549,364,1,Democratic local particular participant.,2025-06-09
550,435,1,Maybe art class past long.,2025-09-20
551,49,1,Left develop hotel region year thought mother.,2025-06-04
552,489,1,Truth itself economy democratic sometimes newspaper.,2025-09-24
553,59,1,Owner current reduce bar.,2025-03-08
554,428,1,Official ground a herself security this church.,2025-07-02
555,264,1,Ahead simple camera.,2025-07-26
556,277,1,Radio national popular if clearly throw.,2025-03-30
557,77,1,For for partner land explain PM.,2025-02-20
558,265,1,Challenge arrive service stock another door.,2025-02-18
559,454,1,Identify message between draw.,2025-04-10
560,297,1,Specific term consumer field such attention method kid.,2025-04-16
561,397,1,They energy phone box model magazine paper feeling.,2025-06-11
562,233,1,Various me professor soldier action somebody family.,2025-10-17
563,2,1,Record health way require.,2025-04-12
564,293,1,Watch story west maybe seat.,2025-03-17
565,157,1,Girl environment maybe of.,2025-06-07
566,411,1,Blood help radio.,2025-06-10
567,347,1,Performance run prove prevent herself response list total.,2025-01-15
568,472,1,Camera late store hear well forget daughter adult.,2025-03-30
569,95,1,Unit that child follow produce.,2025-08-12
570,266,1,Air staff glass among politics next.,2025-07-11
571,41,1,Into point decade while recognize probably likely.,2025-02-16
572,335,1,May skin successful institution firm whether everything nation.,2025-03-01
573,215,1,Coach ahead central appear lose meet.,2025-06-07
574,100,1,Raise apply country team.,2025-08-13
575,88,1,Manager able nor movie later join.,2025-03-30
576,240,1,Task form management our later collection.,2025-04-05
577,62,1,Thousand along strong employee.,2025-07-06
578,154,1,Tell save thousand sit rise interesting.,2025-03-11
579,293,1,This occur federal because history modern.,2025-04-12
580,269,1,Form east see rise some his without.,2025-06-29
581,244,1,Program image military onto.,2025-03-10
582,280,1,Fall forward read stuff guy.,2025-06-06
583,496,1,Soldier behavior student team defense matter word.,2025-09-20
584,260,1,Name even year focus author while.,2025-01-16
585,274,1,Six form that so music significant.,2025-02-07
586,245,1,Hand exactly according could resource process fire.,2025-06-02
587,272,1,Growth when every once affect us.,2025-08-30
588,474,1,School reduce chance.,2025-07-26
589,481,1,Feel number still meet carry.,2025-08-28
590,327,1,Newspaper tough order me standard gas another.,2025-04-25
591,170,1,Four situation group father budget science say.,2025-05-23
592,75,1,Teacher visit difficult him than set throw.,2025-07-06
593,13,1,Throw mean security very follow.,2025-07-09
594,3,1,Fall voice trouble doctor possible war.,2025-08-31
595,139,1,Attention PM see new simple.,2025-01-02
596,16,1,Live help son.,2025-02-03
597,333,1,Serious bit later serious.,2025-03-24
598,165,1,Window writer attorney.,2025-04-11
599,163,1,Woman chair your learn unit view policy.,2025-04-11
600,259,1,Tax plant series big shoulder while.,2025-04-21
601,445,1,Bank even change seek beat.,2025-02-21
602,328,1,Research system ok nature forward.,2025-01-01
603,399,1,Such often ball worry around fall return become.,2025-07-06
604,472,1,Impact authority exist apply scene career little.,2025-07-22
605,266,1,Seat bar west training citizen.,2025-07-03
606,422,1,Remember budget skill road out always thus.,2025-01-21
607,81,1,Relationship issue police street citizen despite father matter.,2025-02-28
608,432,1,During as people rich eight.,2025-03-15
609,112,1,Amount picture measure school establish military course.,2025-04-23
610,250,1,Tell wonder analysis.,2025-10-13
611,227,1,Class can drive include machine.,2025-08-05
612,67,1,Dinner at finally glass certainly certain concern.,2025-09-29
613,450,1,Half shoulder if office listen political.,2025-10-05
614,246,1,Knowledge term spring trip expert.,2025-01-23
615,494,1,Standard be thousand bit often.,2025-06-07
616,172,1,Too woman artist see plant ask under.,2025-06-07
617,295,1,Leave choose grow remain short.,2025-10-04
618,142,1,Man south first hold.,2025-05-30
619,209,1,Reality happy his church.,2025-06-30
620,225,1,Subject general play even throughout ahead daughter.,2025-01-26
621,164,1,Four them Republican goal.,2025-08-28
622,253,1,Star magazine important author.,2025-08-24
623,384,1,Thank maybe peace.,2025-06-21
624,228,1,City check health reality.,2025-03-12
625,364,1,Ago water chance check staff matter account.,2025-04-25
626,7,1,Camera blue deep none produce.,2025-06-10
627,229,1,Magazine accept range college speech.,2025-07-22
628,10,1,Surface role mouth pay contain view floor.,2025-09-27
629,464,1,If traditional available shoulder senior hospital.,2025-02-28
630,492,1,Hospital wonder meet perhaps sport must practice boy.,2025-09-29
631,4,1,Plan charge fish forget put Congress think.,2025-09-08
632,308,1,Mother fly player over recent pick.,2025-09-23
633,299,1,Man kitchen ever assume in.,2025-03-07
634,200,1,Hospital church camera wife edge good identify.,2025-02-12
635,53,1,Hot you mother step manager write.,2025-10-12
636,491,1,Return adult medical sound partner building measure.,2025-07-14
637,167,1,Suffer accept some benefit pass reach.,2025-06-15
638,323,1,Stop husband water establish analysis difference industry.,2025-09-02
639,427,1,To drive any enjoy.,2025-05-10
640,440,1,Note thousand story case impact man.,2025-08-20
641,362,1,Young another I relationship degree us.,2025-02-10
642,453,1,Per ten house.,2025-04-28
643,319,1,Return successful cold focus some according.,2025-02-09
644,371,1,Form young event.,2025-07-20
645,106,1,Else international way agree enjoy indeed.,2025-05-01
646,402,1,Doctor teach small.,2025-02-12
647,354,1,Know night kitchen anything guy member.,2025-08-05
648,474,1,Happy available which draw leg successful final.,2025-07-09
649,4,1,Ever attack early include traditional always take.,2025-02-12
650,126,1,All recent court south on.,2025-02-27
651,306,1,Reveal letter experience sister wrong there home room.,2025-05-12
652,453,1,Fight size you act be.,2025-03-16
653,4,1,Television office because condition field yourself night.,2025-06-07
654,366,1,Month get family light amount number girl.,2025-04-08
655,179,1,Raise region society source would attack.,2025-03-03
656,359,1,Court entire follow.,2025-06-15
657,492,1,Entire information suggest imagine part until of.,2025-04-30
658,450,1,On old receive example affect.,2025-07-16
659,165,1,Bag still official.,2025-05-29
660,314,1,Last against day strong describe write although.,2025-09-09
661,341,1,Draw heavy stand before.,2025-06-06
662,252,1,Mind manage forward eight.,2025-06-13
663,362,1,Put morning chance thus.,2025-04-09
664,430,1,Hear music able dream design.,2025-01-06
665,450,1,Behind determine whatever suffer.,2025-01-05
666,117,1,Call message government help Mrs.,2025-08-23
667,69,1,Across special lot add represent true speech.,2025-08-13
668,390,1,Charge ahead why against according allow.,2025-08-04
669,272,1,Movie performance draw find study.,2025-08-13
670,71,1,Surface suffer occur risk occur unit.,2025-01-01
671,325,1,Certainly everything decision wonder play feel reach long.,2025-01-06
672,227,1,Which news book physical involve song meet former.,2025-07-28
673,164,1,President true field perhaps meet generation radio.,2025-06-29
674,177,1,Research can conference sell others region.,2025-04-20
675,327,1,West right big one thousand role top.,2025-04-28
676,104,1,Now foreign he police environment room.,2025-08-13
677,499,1,Number bed create scene scientist health.,2025-08-14
678,417,1,Write fund likely likely.,2025-06-11
679,215,1,Itself nice reality administration minute fine measure.,2025-07-22
680,300,1,Although international consider season produce.,2025-01-28
681,287,1,Business edge want.,2025-08-14
682,6,1,Bag term music class city impact.,2025-07-22
683,237,1,Add almost might forget until just popular.,2025-09-10
684,334,1,Bad ground back.,2025-10-15
685,100,1,Serious especially property one.,2025-01-27
686,193,1,Enjoy else catch environment never maintain something.,2025-04-12
687,309,1,Pass subject can build us trial.,2025-07-23
688,203,1,Hard begin start candidate prepare.,2025-03-15
689,148,1,Bed ability history education suffer bed we.,2025-07-12
690,468,1,You little line family beat manage price.,2025-07-08
691,138,1,Condition trial American statement.,2025-07-16
692,37,1,Natural word painting I Democrat.,2025-05-16
693,64,1,Design identify your world number nor.,2025-07-27
694,47,1,Left day father.,2025-10-13
695,281,1,Character him under owner.,2025-04-30
696,403,1,Continue answer movie perhaps process certainly off information.,2025-05-03
697,316,1,Floor design car hospital second specific.,2025-01-22
698,18,1,Nor professor firm base.,2025-03-05
699,369,1,During last serve yeah skill.,2025-05-19
700,473,1,People down wind wrong fund.,2025-05-25
701,472,1,Little summer war tree standard any group.,2025-09-05
702,82,1,Market shake opportunity health exactly would.,2025-03-17
703,416,1,Data increase knowledge with anyone.,2025-05-12
704,37,1,Herself area somebody finish hour act important single.,2025-07-10
705,497,1,Task international site.,2025-01-28
706,415,1,Specific size create family true.,2025-05-05
707,84,1,Quite agreement its boy.,2025-03-25
708,465,1,Fish dinner property ball only daughter structure.,2025-02-08
709,89,1,Analysis simple total American lay rise leg.,2025-05-24
710,176,1,Try produce region think.,2025-08-14
711,400,1,Brother hotel common entire maybe.,2025-08-19
712,194,1,Small company read only.,2025-02-12
713,406,1,East movement international become minute appear.,2025-08-27
714,315,1,Along billion similar stage foot.,2025-06-06
715,29,1,Democratic type where development man.,2025-06-13
716,227,1,Sea tough green ahead provide piece bar serious.,2025-08-13
717,411,1,Nation lay training provide candidate.,2025-03-02
718,186,1,Magazine fast value later.,2025-05-23
719,285,1,Sit teach own enter away around compare.,2025-03-31
720,70,1,Foot from quickly rock behind left during lot.,2025-08-11
721,172,1,Consumer data sort different condition event yet.,2025-07-16
722,303,1,Value remain technology word production.,2025-09-18
723,397,1,Raise degree quickly tell get beyond.,2025-03-17
724,68,1,Sure trip building site receive rule.,2025-01-11
725,421,1,Social school control recent keep hold.,2025-06-11
726,64,1,Present letter member.,2025-06-09
727,303,1,Long remain say across bed attention.,2025-10-07
728,401,1,Hotel doctor second drive serious yes.,2025-08-01
729,340,1,Order morning number middle.,2025-01-05
730,130,1,Draw least suffer arrive public others.,2025-02-04
731,270,1,Another movie population especially strong.,2025-01-25
732,497,1,Threat hospital myself their trouble use soldier.,2025-06-03
733,42,1,Assume challenge each of above strong.,2025-04-08
734,148,1,Reach themselves man actually across.,2025-01-04
735,297,1,Arrive even something approach.,2025-02-02
736,377,1,Whether result more bed however forward.,2025-04-15
737,474,1,Down without their apply building money.,2025-10-17
738,159,1,Career benefit great.,2025-08-18
739,45,1,Goal particular message quality marriage science.,2025-02-03
740,422,1,Pick business peace matter.,2025-07-01
741,40,1,Particularly Republican difficult unit around glass available doctor.,2025-03-09
742,156,1,He computer appear media dark view.,2025-05-18
743,483,1,Commercial pretty scene expect.,2025-06-17
744,329,1,Sport drug detail especially room light.,2025-04-18
745,8,1,Paper another wrong talk yes suffer.,2025-09-18
746,154,1,Edge style outside financial model pick.,2025-02-22
747,69,1,Form win idea today attack when.,2025-09-25
748,83,1,Public practice best here indicate.,2025-05-09
749,310,1,Former friend central well.,2025-05-29
750,466,1,Claim south similar recognize product future international keep.,2025-02-24
751,448,1,Where issue while food.,2025-05-03
752,153,1,Suffer indicate chair sea cultural down note talk.,2025-04-19
753,479,1,History Mr live century.,2025-07-04
754,289,1,Clearly floor blood occur hit.,2025-06-24
755,19,1,A surface almost forget soon.,2025-07-28
756,156,1,Director writer ten stay such Congress child.,2025-04-30
757,100,1,Mr leg who serious final attorney.,2025-07-30
758,104,1,Night how interview environmental admit defense.,2025-08-24
759,126,1,He political protect important.,2025-06-11
760,40,1,Church similar international hospital.,2025-07-04
761,287,1,Edge serious heavy opportunity either catch.,2025-01-27
762,282,1,Maybe generation away next stuff.,2025-09-21
763,158,1,Along drug home week early or.,2025-10-12
764,36,1,Society without so building west computer image.,2025-06-20
765,241,1,Clear central article option least rock.,2025-08-04
766,79,1,Community positive factor choose.,2025-05-17
767,47,1,Door including cell this.,2025-06-28
768,321,1,Themselves wide begin line care put politics team.,2025-03-17
769,131,1,Medical family star nature mother last.,2025-08-11
770,148,1,Speak bank under at herself marriage.,2025-09-23
771,272,1,Result political exactly network almost economic.,2025-07-26
772,55,1,Care strategy adult certainly staff.,2025-08-26
773,176,1,Or least section job.,2025-06-29
774,143,1,Themselves moment reflect budget today.,2025-06-11
775,141,1,Require tell surface loss southern myself guess.,2025-07-04
776,167,1,Likely face important hand offer manage raise money.,2025-03-01
777,345,1,Field talk pressure difference.,2025-05-09
778,257,1,Pretty family perhaps out size.,2025-10-03
779,239,1,Clear time here different else process play while.,2025-06-29
780,442,1,Short bring cause television.,2025-08-21
781,1,1,Husband series modern.,2025-06-15
782,343,1,Consumer let stuff trip.,2025-06-22
783,279,1,Job field head most.,2025-07-15
784,441,1,Close impact rather try talk alone.,2025-04-01
785,221,1,This lay kind store clearly TV.,2025-05-02
786,179,1,Direction stuff will industry trade.,2025-04-08
787,436,1,Call now might fine control contain toward thus.,2025-03-02
788,55,1,Writer case figure go author fall these option.,2025-10-01
789,188,1,Most yet speech cut respond exist.,2025-03-02
790,368,1,Ago green effort strong quality claim follow.,2025-04-07
791,60,1,Too character late significant probably accept day.,2025-10-07
792,388,1,Base body me sort happen under high.,2025-09-13
793,108,1,Small city Mrs social what what detail.,2025-07-25
794,470,1,Keep their probably official film ability goal.,2025-07-24
795,398,1,Range network day avoid help cold.,2025-05-03
796,254,1,Language instead suddenly organization far.,2025-02-20
797,341,1,Also wonder better them night.,2025-04-03
798,447,1,Main opportunity through individual technology yeah.,2025-07-25
799,119,1,Notice chance treatment pretty way moment national while.,2025-04-15
800,221,1,Deep read talk.,2025-07-23
801,9,1,American parent tend group green floor have.,2025-01-13
802,74,1,Treatment personal just about himself perhaps.,2025-06-10
803,200,1,Different form education behavior.,2025-01-15
804,30,1,Right career usually fund bad sign join follow.,2025-06-20
805,244,1,Story and back partner.,2025-08-08
806,80,1,Two between south seek person.,2025-10-13
807,218,1,Often before door response.,2025-03-10
808,205,1,Notice claim store within middle budget.,2025-02-23
809,48,1,Evidence likely able issue situation everybody power.,2025-08-21
810,256,1,Nothing yourself center degree.,2025-01-07
811,432,1,Past why far game home out administration.,2025-08-12
812,118,1,Stuff none fish admit.,2025-07-19
813,362,1,Success resource stock they standard.,2025-08-05
814,87,1,High official trouble activity peace weight.,2025-07-25
815,75,1,Southern bill great gas number last.,2025-07-23
816,224,1,Impact create music face actually move.,2025-01-07
817,239,1,Then include good painting push.,2025-05-15
818,23,1,Half south force full fight lot you.,2025-07-13
819,445,1,Under can summer action table.,2025-09-17
820,258,1,Short measure among fight find.,2025-01-04
821,132,1,Mean phone maybe what program economic.,2025-04-26
822,147,1,Policy ever though place should its.,2025-02-01
823,189,1,Loss technology natural summer early magazine too than.,2025-03-24
824,54,1,Road moment charge significant.,2025-01-23
825,212,1,Building simple almost political meeting half evidence arm.,2025-02-01
826,431,1,Even late college media nor professor fill.,2025-05-19
827,54,1,Learn response foreign.,2025-10-18
828,190,1,Democratic example color alone crime.,2025-09-09
829,35,1,Politics simply say fly thought mind realize.,2025-01-27
830,219,1,Level that information run method.,2025-09-04
831,438,1,Speech inside identify key other war.,2025-03-04
832,432,1,Action three hope stand group second huge.,2025-09-21
833,134,1,Way amount foreign wall.,2025-07-16
834,107,1,Throw wear value personal.,2025-02-17
835,444,1,Police car none property better yourself.,2025-04-24
836,432,1,Take address see plan animal admit need matter.,2025-01-06
837,281,1,Themselves style month sense with life.,2025-09-06
838,456,1,Community front car hotel relationship catch which.,2025-10-12
839,288,1,Art suddenly science world.,2025-04-03
840,161,1,Call writer individual wall charge.,2025-01-02
841,166,1,Step film sing choice truth police.,2025-05-26
842,28,1,Her certainly argue.,2025-05-30
843,264,1,Rest arm image help manager draw business peace.,2025-01-22
844,179,1,This have country.,2025-06-10
845,348,1,Feeling thought third trouble risk current.,2025-01-22
846,174,1,Evening leave major important defense.,2025-07-22
847,258,1,Feel nearly perform since why.,2025-05-31
848,319,1,Enjoy world spend even lay them arrive.,2025-01-09
849,411,1,Near middle main agreement now.,2025-02-02
850,293,1,Green hope run often yeah.,2025-08-03
851,389,1,Prevent group center social oil president city.,2025-01-14
852,99,1,Recognize culture off.,2025-01-29
853,16,1,Become question owner rule listen.,2025-08-01
854,167,1,Decision single I notice.,2025-03-29
855,116,1,Rate recent head politics certainly.,2025-04-23
856,251,1,Soldier land bed marriage data.,2025-08-30
857,30,1,Far floor guess individual.,2025-04-03
858,72,1,Personal almost share.,2025-08-11
859,454,1,Reach relationship long yourself school environmental each.,2025-07-08
860,146,1,Board position perform my.,2025-04-25
861,364,1,Dark operation seat accept well.,2025-03-08
862,485,1,Particularly ask bit.,2025-05-29
863,436,1,Talk plan meeting.,2025-09-24
864,86,1,Eye oil represent choice.,2025-07-30
865,73,1,Shake size law herself.,2025-09-04
866,399,1,Civil serious season.,2025-05-15
867,228,1,Record entire education degree newspaper husband.,2025-06-08
868,154,1,Enough should strong goal night a bit.,2025-07-24
869,470,1,Someone but between kitchen poor worker instead forward.,2025-09-22
870,424,1,Ever effort sport single affect.,2025-02-16
871,11,1,Finally space mouth several civil probably.,2025-03-24
872,415,1,Community sell manage card high.,2025-03-01
873,424,1,Nature theory agency too.,2025-03-29
874,331,1,Increase prepare whom section successful.,2025-10-09
875,329,1,Easy over store fly simply recently leader.,2025-08-31
876,434,1,Ready old face same involve customer suffer.,2025-02-17
877,230,1,Hit check end bag blue fill.,2025-06-10
878,202,1,Parent fly along situation issue.,2025-01-02
879,339,1,Occur today discover professional continue.,2025-08-31
880,308,1,Billion project employee indeed finish argue hour.,2025-04-26
881,452,1,Quite wish continue both room.,2025-03-10
882,43,1,Skill ahead management budget PM nation.,2025-09-13
883,410,1,Will pretty meet usually might model figure.,2025-08-10
884,1,1,New skin draw at near deal voice stuff.,2025-08-03
885,411,1,Interest glass speech story speech determine.,2025-10-12
886,102,1,Brother allow fear effect.,2025-03-08
887,286,1,Their rest whatever ball fine policy great.,2025-09-13
888,194,1,Glass audience goal chance southern hit.,2025-06-27
889,208,1,Bank look work early together bill.,2025-01-07
890,355,1,What allow society admit some top.,2025-04-01
891,27,1,Answer head population land.,2025-01-28
